{
  "level": "A2",
  "model_id": "synthetic-bank-a2",
  "model_version": "2026.10",
  "metamodel_version": "0.4.0",
  "source_system": "SYNTHETIC-BIAN-WORKBENCH",
  "instances": [
    {
      "id": "BD-FRAUD",
      "type": "A2.BusinessDomain",
      "version": "1.0",
      "name": "Fraud and Risk (synthetic grouping)",
      "lifecycle_status": "active",
      "description": "Synthetic grouping of fraud and risk Service Domains."
    },
    {
      "id": "SD-044",
      "type": "A2.ServiceDomain",
      "version": "1.0",
      "name": "Fraud Detection (synthetic selection)",
      "lifecycle_status": "active",
      "canonical_id": "BIAN-FRAUD-DETECTION",
      "description": "Synthetic stand-in for a BIAN fraud-detection Service Domain: evaluates transactions and activity for indications of fraud and raises alerts."
    },
    {
      "id": "SG-044-01",
      "type": "A2.ServiceGroup",
      "version": "1.0",
      "name": "Fraud Case Operations",
      "lifecycle_status": "active",
      "description": "Operations for raising, evaluating and resolving fraud cases."
    },
    {
      "id": "SO-044-07",
      "type": "A2.ServiceOperation",
      "version": "1.0",
      "name": "Notify Fraud Alert",
      "lifecycle_status": "active",
      "description": "Notify an interested party of a suspected fraud event and record their response.",
      "attributes": {
        "action_term": "Notify",
        "behavior_qualifier": "Alert",
        "input_attributes": [
          "alert_reference",
          "party_reference",
          "transaction_reference"
        ],
        "output_attributes": [
          "alert_reference",
          "notification_status",
          "party_response"
        ]
      }
    },
    {
      "id": "CR-044",
      "type": "A2.ControlRecord",
      "version": "1.0",
      "name": "Fraud Detection Control Record",
      "lifecycle_status": "active",
      "description": "Control record tracking fraud evaluations and alert outcomes.",
      "attributes": {
        "attributes": [
          "alert_reference",
          "transaction_reference",
          "party_reference",
          "risk_score",
          "alert_status",
          "notification_status",
          "party_response",
          "evaluation_date"
        ]
      }
    },
    {
      "id": "BS-FRAUD-ALERT",
      "type": "A2.BusinessScenario",
      "version": "1.0",
      "name": "Suspicious card transaction alerted",
      "lifecycle_status": "active",
      "description": "A scored transaction raises an alert; the cardholder is notified and their response recorded.",
      "attributes": {
        "operation_sequence": [
          "SO-044-07"
        ]
      }
    }
  ],
  "relationships": [
    {
      "source": "BD-FRAUD",
      "kind": "composition",
      "target": "SD-044"
    },
    {
      "source": "SD-044",
      "kind": "composition",
      "target": "SG-044-01"
    },
    {
      "source": "SG-044-01",
      "kind": "composition",
      "target": "SO-044-07"
    },
    {
      "source": "SD-044",
      "kind": "aggregation",
      "target": "CR-044"
    },
    {
      "source": "BS-FRAUD-ALERT",
      "kind": "aggregation",
      "target": "SO-044-07"
    }
  ]
}
