{
  "level": "A3",
  "model_id": "synthetic-bank-a3",
  "model_version": "2026.10",
  "metamodel_version": "0.5.0",
  "source_system": "SYNTHETIC-APM",
  "instances": [
    {
      "id": "APP-FRAUD-ENGINE",
      "type": "A3.ApplicationComponent",
      "version": "4.2",
      "name": "Fraud Engine",
      "lifecycle_status": "active",
      "attributes": {
        "vendor": "in-house",
        "deployed_on": [
          "INF-CLOUD-K8S-PROD"
        ],
        "deployed_as": [
          "DEP-FRAUD-PROD"
        ]
      },
      "description": "Real-time scoring of card transactions against fraud models; dispatches alerts to channels and records outcomes."
    },
    {
      "id": "CMP-SCORING",
      "type": "A3.ApplicationComponent",
      "version": "4.2",
      "name": "Transaction Scoring",
      "lifecycle_status": "active",
      "description": "Scores a transaction against the active fraud models and returns a risk band."
    },
    {
      "id": "IFC-FRAUD-API",
      "type": "A3.ApplicationInterface",
      "version": "3.1",
      "name": "Fraud API",
      "lifecycle_status": "active",
      "description": "REST interface exposing fraud alert and case operations to channels."
    },
    {
      "id": "POST /fraud/alerts",
      "type": "A3.APIOperation",
      "version": "3.1",
      "name": "Create fraud alert",
      "lifecycle_status": "active",
      "description": "Creates a fraud alert for a transaction and triggers cardholder notification.",
      "attributes": {
        "method": "POST",
        "path": "/fraud/alerts",
        "payload_fields": [
          "alert_reference",
          "transaction_reference",
          "party_reference",
          "risk_score",
          "notification_status",
          "party_response"
        ]
      }
    }
  ],
  "relationships": [
    {
      "source": "APP-FRAUD-ENGINE",
      "kind": "composition",
      "target": "CMP-SCORING"
    },
    {
      "source": "APP-FRAUD-ENGINE",
      "kind": "composition",
      "target": "IFC-FRAUD-API"
    },
    {
      "source": "IFC-FRAUD-API",
      "kind": "composition",
      "target": "POST /fraud/alerts"
    }
  ]
}
