{
  "level": "A1",
  "model_id": "synthetic-bank-payments-a1",
  "model_version": "2026.10",
  "metamodel_version": "0.7.0",
  "source_system": "SYNTHETIC-EA-TOOL",
  "instances": [
    {
      "id": "CAP-PAY-000",
      "type": "A1.BusinessCapability",
      "version": "1.0",
      "name": "Payments",
      "lifecycle_status": "active",
      "description": "Move money on behalf of customers: initiate, execute, settle and report payments across schemes.",
      "attributes": {
        "level": 1,
        "strategic_importance": "core",
        "maturity_current": 3,
        "maturity_target": 4,
        "owner": "ROLE-PAY-OFFICER",
        "conforms_to": [
          "BIAN BCM 14.0"
        ],
        "subject": [
          "payments"
        ]
      }
    },
    {
      "id": "CAP-PAY-010",
      "type": "A1.BusinessCapability",
      "version": "1.0",
      "name": "Initiate Payment",
      "lifecycle_status": "active",
      "description": "Capture a customer's payment instruction, validate and authorise it, and hand it to execution — for credit transfers from a customer account.",
      "attributes": {
        "level": 2,
        "strategic_importance": "core",
        "maturity_current": 2,
        "maturity_target": 4,
        "owner": "ROLE-PAY-OFFICER",
        "conforms_to": [
          "BIAN BCM 14.0"
        ],
        "subject": [
          "payments"
        ],
        "access_classification": "internal"
      }
    },
    {
      "id": "VS-MAKE-PAYMENT",
      "type": "A1.ValueStream",
      "version": "1.0",
      "name": "Make a Payment",
      "lifecycle_status": "active",
      "description": "The customer's journey from deciding to pay someone to seeing the payment confirmed.",
      "attributes": {
        "stages": [
          "VSS-P1",
          "VSS-P2",
          "VSS-P3",
          "VSS-P4"
        ],
        "stakeholder": "retail customer",
        "value_proposition": "money reaches the payee quickly and safely",
        "owner": "ROLE-PAY-OFFICER"
      }
    },
    {
      "id": "VSS-P1",
      "type": "A1.ValueStreamStage",
      "version": "1.0",
      "name": "Capture payment instruction",
      "lifecycle_status": "active",
      "description": "The customer enters payee, amount and date.",
      "attributes": {
        "value_item": "a complete, correct instruction",
        "entrance_criteria": "customer decides to pay",
        "exit_criteria": "instruction captured"
      }
    },
    {
      "id": "VSS-P2",
      "type": "A1.ValueStreamStage",
      "version": "1.0",
      "name": "Validate and authorise",
      "lifecycle_status": "active",
      "description": "The instruction is checked and the customer authorises it.",
      "attributes": {
        "value_item": "an authorised instruction",
        "entrance_criteria": "instruction captured",
        "exit_criteria": "instruction authorised"
      }
    },
    {
      "id": "VSS-P3",
      "type": "A1.ValueStreamStage",
      "version": "1.0",
      "name": "Execute transfer",
      "lifecycle_status": "active",
      "description": "The bank executes the transfer."
    },
    {
      "id": "VSS-P4",
      "type": "A1.ValueStreamStage",
      "version": "1.0",
      "name": "Confirm to customer",
      "lifecycle_status": "active",
      "description": "The customer sees the payment status."
    },
    {
      "id": "PRC-PAY-01",
      "type": "A1.BusinessProcess",
      "version": "1.0",
      "name": "Capture and validate payment instruction",
      "lifecycle_status": "active",
      "description": "Capture the instruction from the channel, validate it against account and scheme rules, obtain authorisation.",
      "attributes": {
        "invokes": [
          "SO-PI-01",
          "SO-PI-02"
        ],
        "level": 2,
        "triggered_by": "customer submits a payment",
        "outcome": "authorised payment instruction",
        "criticality": "high",
        "frequency": "continuous",
        "automation_level": "automated",
        "owner": "ROLE-PAY-OFFICER",
        "modified": "2026-09-30"
      }
    },
    {
      "id": "ACT-PAY-01a",
      "type": "A1.BusinessActivity",
      "version": "1.0",
      "name": "Capture instruction",
      "lifecycle_status": "active",
      "description": "Record the payee, amount, currency and value date.",
      "attributes": {
        "invokes": [
          "SO-PI-01"
        ],
        "sequence": 1
      }
    },
    {
      "id": "ACT-PAY-01b",
      "type": "A1.BusinessActivity",
      "version": "1.0",
      "name": "Validate instruction",
      "lifecycle_status": "active",
      "description": "Evaluate the instruction for completeness, limits and sanctions.",
      "attributes": {
        "invokes": [
          "SO-PI-02"
        ],
        "sequence": 2
      }
    },
    {
      "id": "PRC-PAY-02",
      "type": "A1.BusinessProcess",
      "version": "1.0",
      "name": "Execute and confirm payment",
      "lifecycle_status": "active",
      "description": "Execute the authorised instruction and report its status to the customer.",
      "attributes": {
        "invokes": [
          "SO-PI-03",
          "SO-PI-04"
        ],
        "level": 2,
        "triggered_by": "instruction authorised",
        "outcome": "payment executed and confirmed",
        "criticality": "high",
        "frequency": "continuous",
        "automation_level": "partly automated",
        "owner": "ROLE-PAY-OFFICER",
        "modified": "2026-09-30"
      }
    },
    {
      "id": "ACT-PAY-02a",
      "type": "A1.BusinessActivity",
      "version": "1.0",
      "name": "Execute payment",
      "lifecycle_status": "active",
      "description": "Submit the instruction for execution.",
      "attributes": {
        "invokes": [
          "SO-PI-03"
        ],
        "sequence": 1
      }
    },
    {
      "id": "ACT-PAY-02b",
      "type": "A1.BusinessActivity",
      "version": "1.0",
      "name": "Retrieve status",
      "lifecycle_status": "active",
      "description": "Obtain the current status of the instruction.",
      "attributes": {
        "invokes": [
          "SO-PI-04"
        ],
        "sequence": 2
      }
    },
    {
      "id": "BO-PAY-INSTR",
      "type": "A1.BusinessObject",
      "version": "1.0",
      "name": "Payment Instruction",
      "lifecycle_status": "active",
      "description": "A customer's request to pay an amount to a payee on a date.",
      "attributes": {
        "attributes": [
          "debtor_account",
          "creditor_account",
          "amount",
          "currency",
          "value_date",
          "payment_reference",
          "remittance_information"
        ],
        "glossary_uri": "https://example.org/glossary/payment-instruction",
        "personal_information": true,
        "access_classification": "confidential"
      }
    },
    {
      "id": "BO-PAYEE",
      "type": "A1.BusinessObject",
      "version": "1.0",
      "name": "Payee",
      "lifecycle_status": "active",
      "description": "A party the customer pays.",
      "attributes": {
        "attributes": [
          "payee_name",
          "payee_account",
          "payee_bank"
        ],
        "glossary_uri": "https://example.org/glossary/payee",
        "personal_information": true,
        "access_classification": "confidential"
      }
    },
    {
      "id": "ROLE-PAY-OFFICER",
      "type": "A1.BusinessRole",
      "version": "1.0",
      "name": "Payments Operations Officer",
      "lifecycle_status": "active",
      "description": "Handles exceptions in payment processing.",
      "attributes": {
        "role_kind": "role",
        "responsibilities": "handle exceptions in payment processing"
      }
    }
  ],
  "relationships": [
    {
      "source": "CAP-PAY-000",
      "kind": "composition",
      "target": "CAP-PAY-010"
    },
    {
      "source": "VS-MAKE-PAYMENT",
      "kind": "composition",
      "target": "VSS-P1"
    },
    {
      "source": "VS-MAKE-PAYMENT",
      "kind": "composition",
      "target": "VSS-P2"
    },
    {
      "source": "VS-MAKE-PAYMENT",
      "kind": "composition",
      "target": "VSS-P3"
    },
    {
      "source": "VS-MAKE-PAYMENT",
      "kind": "composition",
      "target": "VSS-P4"
    },
    {
      "source": "CAP-PAY-010",
      "kind": "serving",
      "target": "VS-MAKE-PAYMENT"
    },
    {
      "source": "PRC-PAY-01",
      "kind": "realization",
      "target": "CAP-PAY-010"
    },
    {
      "source": "PRC-PAY-02",
      "kind": "realization",
      "target": "CAP-PAY-010"
    },
    {
      "source": "PRC-PAY-01",
      "kind": "composition",
      "target": "ACT-PAY-01a"
    },
    {
      "source": "PRC-PAY-01",
      "kind": "composition",
      "target": "ACT-PAY-01b"
    },
    {
      "source": "PRC-PAY-02",
      "kind": "composition",
      "target": "ACT-PAY-02a"
    },
    {
      "source": "PRC-PAY-02",
      "kind": "composition",
      "target": "ACT-PAY-02b"
    },
    {
      "source": "ROLE-PAY-OFFICER",
      "kind": "assignment",
      "target": "PRC-PAY-02"
    },
    {
      "source": "PRC-PAY-01",
      "kind": "access",
      "target": "BO-PAY-INSTR"
    }
  ]
}
